{
  "$schema": "http://json-schema.org/draft-2020-12/schema",
  "title": "Interpretação de Fósforo por Grupo de Exigência e Classe de Argila",
  "type": "object",
  "required": ["descricao", "fonte", "unidade", "metodo", "grupos_exigencia", "tabelas"],
  "properties": {
    "descricao": { "type": "string", "minLength": 1 },
    "fonte": {
      "type": "object",
      "required": ["manual", "tabelas", "paginas"],
      "properties": {
        "manual": { "type": "string" },
        "tabelas": { "type": "array", "items": { "type": "string" } },
        "paginas": { "type": "array", "items": { "type": "integer" } },
        "extraido_do_pdf_em": { "type": ["string", "null"] },
        "conferido_por_autor_em": { "type": ["string", "null"] },
        "aviso_operadores": { "type": ["string", "null"] }
      }
    },
    "unidade": { "type": "string" },
    "metodo": { "type": "string" },
    "conversao_mehlich3": {
      "type": "object",
      "properties": {
        "formula": { "type": "string" },
        "fonte": { "type": "string" }
      }
    },
    "depende_de": { "type": "string" },
    "grupos_exigencia": {
      "type": "array",
      "minItems": 1,
      "items": {
        "type": "object",
        "required": ["grupo", "descricao", "tabela"],
        "properties": {
          "grupo": { "type": "string" },
          "descricao": { "type": "string" },
          "tabela": { "type": "string" },
          "culturas": { "type": "array", "items": { "type": "string" } },
          "culturas_texto": { "type": "string" },
          "culturas_fonte": { "type": "string" },
          "culturas_pendente": { "type": "string" },
          "nota": { "type": "string" }
        }
      }
    },
    "tabelas": {
      "type": "array",
      "minItems": 1,
      "items": {
        "type": "object",
        "required": ["grupo", "fonte"],
        "properties": {
          "grupo": { "type": "string" },
          "fonte": { "type": "string" },
          "nota": { "type": "string" },
          "por_classe_argila": {
            "type": "array",
            "items": {
              "type": "object",
              "required": ["classe_argila", "faixas"],
              "properties": {
                "classe_argila": { "type": "string" },
                "faixas": {
                  "type": "array",
                  "minItems": 1,
                  "items": {
                    "type": "object",
                    "required": ["classe", "de", "ate"],
                    "properties": {
                      "classe": { "type": "string" },
                      "de": { "type": ["number", "null"] },
                      "ate": { "type": ["number", "null"] }
                    }
                  }
                }
              }
            }
          },
          "sem_classe_argila": {
            "type": "array",
            "items": {
              "type": "object",
              "required": ["classe", "de", "ate"],
              "properties": {
                "classe": { "type": "string" },
                "de": { "type": ["number", "null"] },
                "ate": { "type": ["number", "null"] }
              }
            }
          }
        }
      }
    }
  }
}
